Question_Title,Subject_Name,Group_Name,Answer_1,Answer_2,Answer_3,Answer_4,Answer_5,Answer_6,Correct_Answer
"If your vessel is to carry ten portable foam fire extinguishers, you must maintain a supply of at least __________.",Naval,B,one spare extinguisher,one spare charge,five spare charges,ten spare charges,,,3
A portable foam fire extinguisher carried aboard a tank vessel must be recharged every __________.,Naval,B,3 months,6 months,9 months,12 months,,,4
At what interval must a foam fire extinguisher be recharged if the vessel's Certificate of Inspection is issued for a period of two years?,Naval,B,Quarterly,Semiannually,Biennially,Annually,,,4
"Tankers carrying cryogenic cargoes, such as LNG, are fitted with gas detector systems alarmed at 30% of the lower explosive limit.  If the gas detector alarms sounds, this means __________.",Naval,B,the detector sensor is sampling a space where the cargo vapor concentration is 30 percent by volume,an explosion is about to take place,the detector is sampling a space in which 30 percent of the atmosphere is explosive,"a flammable vapor concentration exists at the sample point, but it is too lean to burn",,,4
An LNG carrier has an approved type of gas detecting system to detect methane leaks in the __________.,Naval,B,barrier spaces,cargo handling rooms,boiler burner supply piping,all of the above,,,4
Span gas is used aboard liquefied natural gas carriers to __________.,Naval,B,inert the barrier spaces,calibrate the gas leak detectors,odorize the cargo,detect leaks in cargo piping,,,2
"To prevent the overflow of cargo tanks due to expansion, you should top off __________.",Naval,B,to the bottom of the expansion trunk,to within 1% to 3% of its capacity,to within 1 to 3 inches of its capacity,1 to 3 inches from top of the vent pipe,,,2
"In order to release CO2 to the machinery spaces from a fixed fire extinguishing system, you must __________.",Naval,B,actuate an alarm and open the engine room control valve,actuate an alarm and open the engine room CO2 releasing valve,open the engine room control valve and shut off engine room ventilation fans,open the engine room control valve and then the CO2 releasing valve,,,4
Why is it important for fuel oil tanks not to be topped off at the inner bottom level when loading on a cold day?,Naval,B,"Increased viscosity of the product needs higher loading pressure, which increases the chances of a spill.",Air pockets may cause the fuel to bubble out of the ullage  hole.,The temperature rise of the fuel will cause an overflow.,Fueling valve may become stuck closed and cause the fuel oil to spill before the valve can be opened.,,,3
Which of the following statements describes how the main bank of CO2 bottles is released into an engine room from most fixed CO2 fire extinguishing systems?,Naval,B,Manually releasing the bottles in groups of four.,CO2 pressure from the pilot cylinders.,Steel wire trigger lines provided to all bottles in the main bank.,Remote pull cables provided to each group of four bottles in the main bank.,,,2
"During fueling operations, which of the listed precautions  should be taken when topping off fuel tanks?",Naval,B,Reduce the pumping rate by closing the deck filling valve.,Close all overflow valves.,Place 5 gallon containers under all flange connections in the fuel line.,Reduce the pumping rate and sound tanks frequently as the level rises.,,,4
"The most critical part of the bunkering operations, which can result in an oil spill, is when the __________.",Naval,B,hose joints are made up,tanks are being topped off,system is being lined up,pumping operation is first started,,,2
"After fuel tanks have been topped off, which of the listed  procedures should be followed next?",Naval,B,The pressure-vacuum relief valve should be reset.,The tanks should be made seaworthy to prevent contamination.,The tanks should be sounded to verify levels.,The tanks should be marked with a bull stamp on the manifold filling valve.,,,3
"If the overflow tank high-level alarm sounds while the fuel oil tanks are being topped off, the engineer should __________.",Naval,B,close the static leg filling valve,close the overflow tank filling valve,reduce the fuel oil pumping rate,stop the fuel oil pumping operation,,,4
"To avoid shock pressures in the fuel oil filling hoses while you are topping off tanks, the __________.",Naval,B,loading rate should be decreased,oiler should sound all tanks continuously,hoses should be looped,tank vent valves should be clear,,,1
"When a fuel oil tank is being topped off during bunkering operations, the tank valve should be closed __________.",Naval,B,slowly to prevent surge stresses,to prevent gas from escaping through the pressure-vacuum relief valves,after the shore pumps are stopped,rapidly to prevent overflow,,,3
"The amount of expansion space to be left in a fuel tank when fuel oil is being received, is determined by the __________.",Naval,B,quantity of fuel to be received,flash point of the fuel as it is received,fuel temperature as it is received,viscosity of the fuel being received,,,3
"A cylinder used for storing CO2 in a fixed firefighting system, must be hydrostatically retested and restamped every __________.",Naval,B,once in every calendar year,5 years,8 years,12 years,,,4
The Pollution Prevention Regulations (33 CFR) requires an emergency means of stopping the flow of oil during oil transfer operations.  The emergency means must be operable  from the __________.,Naval,B,usual operating station of the person-in-charge,bridge,engine room,emergency operating station of the person-in-charge,,,1
A cargo pump driven by an internal combustion engine on the weather deck must have __________.,Naval,B,one remote manual shutdown station,two remote manual shutdown stations located fore and aft,"three remote manual shutdown stations located fore, aft, and at the midpoint","four remote manual shutdown stations located fore, aft, port side midpoint, and starboard side midpoint",,,1
A hole in the hull above the waterline may be temporarily patched with __________.,Naval,B,pillows,blankets,mattresses,All of the above.,,,4
Which of the following statements is correct concerning fixed carbon dioxide fire extinguishing systems?,Naval,B,A separate supply of carbon dioxide must be provided for each space protected.,The piping shall be used for no other purpose except that it may be incorporated with the fire-detecting system.,Distribution piping within the space shall be proportioned  from the supply line to give the proper throttling to the outlets.,All of the above.,,,2
"When a tank vessel with a capacity of 250 barrels is transferring oil to a facility, the Pollution Prevention Regulations (33 CFR), require an emergency means to stopping the flow of oil which must be operable from __________.",Naval,B,two or more locations on the tank vessel,a remote location of equal distance from the tank vessel and facility,the usual operating station of the person in charge of the  oil transfer,"the engine room, cargo control room and bridge sequentially",,,3
"In an emergency, a hole in the hull below the waterline, not over three inches in diameter, can be temporarily sealed by __________.",Naval,B,welding over a plate patch,stuffing a mattress in the hole,rigging a collision mat,using a soft wooden plug,,,4
"When a cylinder is used to store CO2 in a fixed firefighting system and is retested in accordance with regulations, all  flexible connections between cylinders and distribution piping must be renewed or tested at __________.",Naval,B,2750 psi,1500 psi,1000 psi,300 psi,,,3
"According to Pollution Prevention Regulations (33 CFR), tank vessels are required to have a means of emergency shutdown. This device __________.",Naval,B,shuts off the main propulsion plant,shuts off the firefighting foam systems,stops the flow of oil to shore facility or other vessel,secures electrical power to all motors,,,3
"Fuel containers used for refueling portable gasoline driven pumps and exceding a capacity of five gallons, should be stowed __________.",Naval,B,in the pumproom,in the engine room,in the paint locker,on or above the weather deck in locations designated by the master,,,4
It is generally not advisable to drive a wedge into a crack occurring in the hull because wedges __________.,Naval,B,tend to open the crack,will work loose,will splinter,will pull through the plating,,,1
Which of the signals listed is required to be displayed during the day while loading fuel?,Naval,B,A red flag,A yellow flag,A red and yellow flag,A red light,,,1
The Pollution Prevention Regulations (33 CFR) requires an emergency means of stopping the flow of oil during oil transfer operations.  That emergency means may be a/an __________.,Naval,B,manually-operated quick-closing valve,self-closing automatic disconnect fitting,emergency pump control on the cargo deck,automatic pressure-sensitive oil flow regulator,,,3
The best emergency repair to a crack forming in the vessel's hull is to __________.,Naval,B,drive wedges into the crack,drill the ends of the crack and apply a concrete patch,weld a doubler plate over the crack,weld a metal box over the crack and applying air pressure,,,2
"The component in an inert gas system used for cleaning the  gas of solid and sulphur combustion products, while simultaneously cooling the inert gas, is called the __________.",Naval,B,filter,cooler,scrubber,purifier,,,3
"According to Pollution Prevention Regulations (33 CFR), the shore facility must have an emergency means to stop the flow of oil to a vessel in __________.",Naval,B,"15 seconds on any facility which starts operations after April 1, 1985","30 seconds on any facility which starts operations after November 1, 1980","90 seconds on any facility which starts operations after December 1, 1976","120 seconds on any facility which starts operations after July 1, 1973",,,2
An acceptable method of temporarily sealing a crack formed  in the hull of a vessel is to __________.,Naval,B,apply a patch of sheet packing backed by a shole and shoring,drill holes at each end,shore up the crack with welded braces,tack weld a doubler plate over the crack,,,1
The fire extinguishing action of CO2 comes mostly from __________.,Naval,B,breaking the fire chemical chain reaction,smothering,cooling,isolating the heat from the fuel,,,2
The emergency shutdown requirements of Pollution Prevention Regulations (33 CFR) apply to __________.,Naval,B,condensate pumps,air compressors,induced draft fans,cargo transfer systems,,,4
"Which of the following represents an emergency procedure used to stop the oil flow aboard tank vessels, of 250 tons  or greater, as required by Pollution Prevention Regulations (33 CFR)?",Naval,B,Quick-acting power actuated valve,Self-closing emergency disconnect fitting,Pressure-sensitive oil pressure controller,Manually-operated quick-closing valve,,,1
Where will you find the procedures for the reporting of oil discharge into the water?,Naval,B,The vessel's Certificate of Inspection,The vessel's Oil Record Book,The vessel's Oil Transfer Procedures,The vessel's International Oil Pollution Prevention Certificate,,,3
Which of the listed functions is the purpose of a gas scrubber in an inert gas generation system?,Naval,B,Cools the inert gas.,Maintains the oxygen content at 5% by volume.,Drains off static electricity in the inert gas.,Maintains the water seal on the gas main.,,,1
The lengthening of a crack formed in the shell plating of a ship may be prevented by __________.,Naval,B,welding brackets across both ends of the crack,chipping out and slot welding the entire crack,drilling a hole at each end of the crack,cutting a square notch at each end of the crack,,,3
"The empty weight of a B-II CO2 fire extinguisher is 34 pounds, therefore, the full charged weight is __________.",Naval,B,44 lbs,49 lbs,54 lbs,59 lbs,,,2
A high concentration of hydrogen sulfide gas is most likely to be found in which of the locations listed?,Naval,B,Fireroom bilges where hydrazine has accumulated.,Sewage compartment bilges where leaked sewage has accumulated.,Engine room bilges where chemical cleaners and solvents have accumulated.,Emergency battery storage compartment where discharge gases have accumulated.,,,2
Portable carbon dioxide fire extinguishers should be sent ashore to be recharged __________.,Naval,B,when the remaining charge volume is less than 90 percent of the required VOLUME,at each inspection for certification,at each annual inspection,when the weight loss exceeds 10% of weight of charge,,,4
Inert gas systems fitted on tank vessels must be fitted with an alarm to give an audible and visual warning when the oxygen content of the inert gas exceeds __________.,Naval,B,4% by volume,8% by volume,12% by volume,16% by volume,,,2
"Prior to entering a shipboard compartment containing spilled sewage, you should test the atmosphere in the compartment for __________.",Naval,B,Hydrogen sulfide,Methane Gas,Oxygen,All of the above,,,4
The empty weight of a '100 pound' cylinder in a fixed CO2 fire extinguishing system is 130 pounds.  What is the minimum acceptable weight of the cylinder before recharging would be required?,Naval,B,200 lbs,210 lbs,220 lbs,230 lbs,,,3
"The blowers of an inert gas generation system aboard a tanker, will be automatically secured if __________.",Naval,B,normal water supply at the water seal is lost,the temperature of the inert gas being delivered to the cargo tanks is more than 150°F,the cooling water supply to the scrubbers is lost,all of the above,,,4
"When pumping sour crude, which gas should be tested for prior to entering the cargo pumproom to repair a leaking pump?",Naval,B,Benzene,Carbon monoxide,Hydrogen sulfide,Tetrathyl lead,,,3
"On a tanker vessel, what is the required combined capacity of the inert gas generating system as compared to the total capacity of all the cargo pumps which can be operated simultaneously?",Naval,B,0.5,0.75,1,1.25,,,4
Waste oil from the lube oil sumps of machinery may NOT be __________.,Naval,B,drained into the vessel's bilges,reclaimed for other uses,held in a slop tank,purified and then reused,,,1
Which of the following methods is used to supply inert gas  from a flue gas system to the cargo tanks?,Naval,B,Exhaust gas pressure,High capacity fan,Inert gas compressor,Natural aspiration,,,2
The Pollution Prevention Regulations (33 CFR) prohibit draining __________.,Naval,B,waste oil into the slop tank,lube oil purifiers into the bilge,fuel oil heaters into buckets,lube oil strainers into drip pans,,,2
"After allowing for pressure losses, the pressure-volume capacity of an inert gas blower must be able to maintain a  pressure, in any cargo tank, with a minimum of __________.",Naval,B,50 millimeters of water,100 millimeters of water,150 millimeters of water,200 millimeters of water,,,2
The Pollution Prevention Regulations (33 CFR) prohibits draining __________.,Naval,B,fuel oil burners into buckets,oil transfer hoses into buckets,fuel oil strainers into the ship's bilges,lube oil strainers into fixed drip pans,,,3
The purpose of the deck seal in an inert gas system is to prevent __________.,Naval,B,flammable vapors from entering machinery space,flue gas escaping to atmosphere,inert gas escaping to atmosphere,air entering inert gas system,,,1
The Pollution Prevention Regulations (33 CFR) state that a  ship's oily bilge slops may be pumped in port only if the __________.,Naval,B,local port authority gives permission,local port authority has completed the required pollution inspection,discharge is led to a slop barge or shoreside tank,engineer on watch has signed the declaration of inspection,,,3
"Open tank hatches and ullage holes from tanks which are not gas free, and unattended, must be protected by __________.",Naval,B,flame screens,warning signs,P.V. valves,stop-check valves,,,1
Bilges may be pumped __________.,Naval,B,on the outgoing tide,overboard after dark,overboard through an oily water separator,"anytime in an emergency, i.e. main engine lube oil failure",,,3
Flame screens used on ullage openings prevent flames from entering a tank by __________.,Naval,B,reducing the cross-sectional area of the opening,restricting the flow of gases through the opening,creating turbulence in the exiting gas stream,dissipating heat from the flame into the surrounding metal,,,4
"Following a grounding, you can best determine that a SLACK  fuel oil tank has been holed by __________.",Naval,B,sounding the tank,waiting for the vessel to list,examining tank boundaries,checking fuel oil strainers,,,1
"According to the Pollution Prevention Regulations, any discharge of oil, or oily mixture into the sea from any oil tanker, or from any ship of 400 gross tons and above, other than an oil tanker, is prohibited while in a ""special"" area. These ""special areas"" are designated in __________.",Naval,B,33 CFR 151,33 CFR 153,33 CFR 156,33 CFR 159,,,1
"Your vessel has run aground and upon taking fuel oil tank soundings, you find that a fuel tank level has increased. You therefore should suspect __________.",Naval,B,condensation in the fuel tank,a crack in the hull portion of the fuel tank,a load of bad fuel,contamination from the saltwater flushing system,,,2
"According to 46 CFR, a single layer of tank vent flame screen must be composed of corrosion resistant wire and  at least a mesh of __________.",Naval,B,8 x  8,10 x 10,20 x 20,30 x 30,,,4
"According to Federal Regulations, new  tank vessels enroute beyond the 50 mile limit may not discharge an oily mixture into the sea from a cargo tank or cargo pump room unless __________.",Naval,B,"the quantity of oil discharged into the sea does not exceed 1/30,000 of the total quantity of cargo carried on board",anchored outside the breakwater,discharging oil at a rate not exceeding 200 liters per nautical mile,"the quantity of oil discharged into the surrounding waters  does not exceed 1/600,000 of the total quantity of cargo carried onboard",,,1
The device used for preventing the passage of flames into enclosed spaces is called a __________.,Naval,B,flame relief valve,flame stopper,safety valve,flame arrester,,,4
How many approved B-II fire extinguishers must be carried in the machinery space of a 3000 HP vessel?,Naval,B,1,2,3,7,,,3
"When cargo oil tanks are cleaned by crude oil washing while in port, __________.",Naval,B,provision should be made for a shoreside holding tank or an onboard slop tank,water should be allowed to settle before discharge overboard,filters should be installed in bilge strainers to absorb oil before discharge overboard,the dock supervisor need not be notified before discharging oily mixtures overboard,,,1
"At the earliest indication of fire aboard your vessel, you  must FIRST __________.",Naval,B,locate the fire,determine which type of fire is burning,sound the alarm,fight the fire,,,3
A new ocean going ship of 2000 gross tons having an inoperative oily water separator may dispose of its bilge slops by __________.,Naval,B,holding its slops onboard until they can be pumped into the city sewer system,circulating them through the lube oil purifier to remove water and debris,holding its slops onboard until they can be discharged to a shoreside reception facility,pumping them into a settling tank for separation before pumping the oily water residue overboard,,,3
Which of the following statements represents the correct action to take when three crew members discover a fire?,Naval,B,"One man report the fire, and the other two men fight the fire.","One man report the fire, one man fight the fire, and one man evacuate and secure the area.","One man report the fire, one man fight the fire, and one man act as a safety observer.",All three men fight the fire and report it immediately after it is extinguished.,,,2
A low velocity fog applicator is held in an all-purpose nozzle by a bayonet joint.  The applicator is prevented from rotating in the joint by __________.,Naval,B,water pressure,a keeper screw,a spring-loaded catch,a locknut,,,3
"In port, after chemically cleaning a fuel oil tank, you should dispose of the waste oil by __________.",Naval,B,pumping it into the sewer connection,centrifuging and reclaiming it,circulating it through an oil and water separator,discharging it into a slop barge or holding tank,,,4
Where would you look to find the number of hand portable fire extinguishers required on an uninspected towing or fishing industry vessel?,Naval,B,Modern Marine Engineer's Manual,"Subchapter C, Rules and Regulations for Uninspected Vessels",The Damage Control Book,Fire fighter's Handbook,,,2
"While in drydock in a U.S. port, you discover that the spool piece for the fire pump sea suction is wasted away.  You should __________.",Naval,B,place a cement box patch on the spool piece,replace the spool piece,silver braze a patch over the leak,patch the leak with epoxy sealer,,,2
"According to Pollution Prevention Regulations (33 CFR), you are required to test cargo discharge piping every __________.",Naval,B,6 months,12 months,18 months,24 months,,,2
"According to the Pollution Prevention Regulations (33 CFR), no person may use a connection for oil transfer operations  unless it is a bolted or full threaded connection, or __________.",Naval,B,an automatic back pressure shut off nozzle is used to fuel the vessel,a clamped or compression fitted connection,a quick connection coupling approved by the American Petroleum Institute,a connection not over six inches in diameter,,,1
"Which of the following statements concerning oil transfer,  related equipment, tests and inspections is true?",Naval,B,Each pressure gauge in the system must indicate a reading that is within 5% of the actual system pressure.,"Each nonmetallic oil transfer hose, larger than a 3"" inside diameter must be inspected, and tested annually.","A 6"" inside diameter nonmetallic oil transfer hose having a small slash penetrating the hose reinforcement may remain in service if there is no visible internal deterioration.",All of the above.,,,2
"According to Pollution Prevention Regulations (33 CFR), a vessel built in 1977 with a gross registered tonnage of 219 tons, must __________.",Naval,B,use one gallon portable containers under tank vents when fueling,use an automatic back pressure shut off nozzle when fueling,use a fixed container or enclosed deck area under or around each lube oil tank vent when fueling,fill fuel tanks forward of the collision bulkhead first,,,2
"Pollution Prevention Regulations (33 CFR) require a 1500 gross ton vessel (constructed before July 1, 1974) equipped with a fill fitting for which discharge containment is impractical to __________.",Naval,B,"have the fill fitting altered on or before December 31, 1986",use a drip collar on the fill fitting,have a designated crew member stand watch over the fill fitting,use an automatic back pressure shut off nozzle,,,4
An ocean going ship of 4000 gross tons must be fitted with a standard discharge shore connection for the discharge of oily wastes to a reception facility.  The dimensions for the connection are specified in the Pollution Prevention Regulations under Part __________.,Naval,B,151,153,154,155,,,4
An ocean going ship of 6000 gross tons or above must be fitted with a standard discharge shore connection with dimensions outlined in Pollution Prevention Regulations (33 CFR) or be substituted with a __________.,Naval,B,portable connection using a four bolt pattern,suitable discharge shore connection,"portable adapter that meets the same specification outlined in 33 CFR, Subchapter ""O""",clip-on flange suitable for service pressure of 4 kg/cm2,,,3
"According to Pollution Prevention Regulations (33 CFR), the minimum number of bolts permitted in an ANSI standard flange on an oil hose is __________.",Naval,B,three,four,six,nine,,,2
"Pollution Prevention Regulations (33 CFR Part 155) state that no person may transfer oil or fuel to a vessel of 300 gross tons or more, constructed after June 30,1974, unless each fuel tank vent, overflow, and fill pipe is equipped with a/an __________.",Naval,B,fixed fuel oil discharge containment,portable fuel oil discharge containment,automatic back pressure shutoff nozzle,quick-closing anti-spill valve,,,1
The Pollution Prevention Regulations (33 CFR) requires that no person may transfer oil to or from a vessel unless __________.,Naval,B,all necessary components of the transfer system are lined up before the transfer begins,all unnecessary parts of the transfer system are open and drained,the transfer system is connected to a flexible overflow fuel hose,the transfer system is connected to an automatic back pressure shutoff nozzle,,,1
"How many emergency outfits are required to be carried onboard all tankships over 1,000 gross tons?",Naval,B,One emergency outfit,Two emergency outfits,Three emergency outfits,Four emergency outfits,,,2
The minimum number of bolts necessary for a standard ANSI oil transfer hose temporary flange coupling (eight bolt hole flange) is __________.,Naval,B,two bolts,four bolts,six bolts,eight bolts,,,2
"Pollution Prevention Regulations (33 CFR Part 156), state that no person may transfer oil to or from a vessel unless  __________.",Naval,B,oil residue has been drained from all hoses,an oil containment boom is available for immediate use,all parts of the transfer system have been properly lined up,a representative sample has been taken from the oil being received,,,3
"As part of the emergency outfit required to be carried onboard all tank vessels over 1000 gross tons, flashlights  must be __________.",Naval,B,of a minimum number of two explosion proof type,listed by NEMA and bearing its label,of the Type II or Type III,all of the above,,,3
