Question_Title,Subject_Name,Group_Name,Answer_1,Answer_2,Answer_3,Answer_4,Answer_5,Answer_6,Correct_Answer
A patient suffering from heat exhaustion should first be __________.,Naval,B,given a mild seawater solution to drink to replace salt and fluids,kept standing and encouraged to walk slowly and continuously,given a glass of water and told to return to work after 15  minutes of rest,moved to a cool room and told to lie down,,,4
"In order to produce a high velocity water fog using an all-purpose nozzle, you must __________.",Naval,B,pull the nozzle handle halfway back,push the nozzle handle completely forward,insert an in-line fog applicator,change to a small nozzle tip after changing the position of the nozzle handle,,,1
Which of the following should NOT be done for a person who has fainted?,Naval,B,Provide fresh air,Loosen clothing,Elevate head,Stimulate face with cold water,,,3
Tank stripping is accomplished more effectively by using a __________.,Naval,B,a multistage centrifugal pump,the load on top system,the water displacement method,a positive displacement pump,,,4
The combined fan discharge rate in an inert gas system is  related to the __________.,Naval,B,shoreside loading rate,maximum cargo pump discharge rate,boiler forced draft fan rate,size of the largest cargo tank,,,2
The symptoms of a fractured back are __________.,Naval,B,leg cramps in the muscles in one or both legs,pain and uncontrolled jerking of the legs and arms,vomiting and involuntary urination or bowel movement,pain at the site of the fracture and possible numbness or paralysis below the injury,,,4
"To fight a large class ""A"" fire contained in a closed compartment, the nozzleman should open a door enough to insert the hose nozzle and initially __________.",Naval,B,sweep a straight stream around the compartment,hold the nozzle steady while applying a straight stream in  the area where he suspects the source of the fire to be,sweep a fog stream around the compartment,hold the nozzle steady and direct a fog stream in the area  where he suspects the fire,,,3
"If an incorrect entry were made in the Oil Record Book, you should __________.",Naval,B,erase the entry and rewrite it,notify the ship's officer-in-charge,completely black it out and make the correct entry alongside,draw a single line through the wrong entry and initial it,,,4
"Generally, when lifting an inflatable liferaft back aboard  ship, you would use the __________.",Naval,B,towing bridle,main weather cover,external lifelines,righting strap,,,1
"While taking on fuel oil, the transfer hose begins leaking, causing a sheen on the water.  You should __________.",Naval,B,apply dispersants to the sheen,repair the leak with duct tape,reduce the rate of transfer,shut down operations,,,4
The sections of an Oil Record Book preceeding the log pages contain a __________.,Naval,B,damage control plan for isolating firemain valves,list of machinery space operation items,complete classification of hazardous materials,detailed listing of all organizations to call in the event of an accidental oil spill,,,2
Which statement regarding garbage disposal is correct?,Naval,B,Records for ground garbage disposal are not required when  disposal into the sea occurs more than 25 miles offshore.,Discharging or transfer of garbage while in port to a shore facility must be recorded.,Maintaining records for the incineration of garbage aboard ship is not required.,The recording of garbage disposal should include the approximate weight.,,,2
"When dumping garbage into the sea, other than special areas, __________.",Naval,B,the U.S. Coast Guard must be notified for each occurence,records must be provided and maintained for two years,an entry into the official log book must be made,no record is required if dumping is carried out more than 25 miles offshore and there is no included plastic material,,,2
"A crack, located in the shell plating or deck plating of a  ship, may be temporarily prevented from increasing in length by __________.",Naval,B,drilling a hole at each end of the crack,installing welded brackets across both ends,V-grooving and welding from both sides of the crack,cutting a square notch at each end of the crack,,,1
Which of the following procedures can be used for checking  for spinal cord damage to an unconscious patient?,Naval,B,"Beginning at the back of the neck, and proceeding to the buttocks, press the spine to find where it hurts.",Prick the skin of the hands and the soles of the feet with  a sharp object to check for reaction.,Selectively raise each arm and each leg and watch patient's face to see if he registers pain.,Roll patient onto his stomach and prick along the length of his spine to check reaction.,,,2
"Which of the following methods should be used to prevent a  class ""A"" fire in a topside compartment, with steel bulkheads, from spreading to the adjacent compartments?",Naval,B,Sweep the exterior bulkheads with a solid stream of water until the fire is reportedly extinguished.,"Sweep the exterior bulkheads with a solid stream of water until steam is no longer produced, secure the nozzle, and repeat as necessary.",Sweep the exterior bulkheads with water fog until the fire  is reportedly extinguished.,"Sweep the exterior bulkheads with water fog until steam is  no longer produced, secure the nozzle, and repeat as necessary.",,,4
Which of the listed procedures should be followed when individuals are rescued in cold climates and suffer from hypothermia?,Naval,B,Give them brandy,Get them to a hot room,Immerse them in a warm bath 104°F (40°),Cover with an electric blanket set for maximum temperature,,,3
The inside light in an inflatable liferaft is turned on __________.,Naval,B,automatically as the liferaft inflates,with a switch near the boarding handle,at night because the light has a photosensitive switch,by screwing the bulb in after the raft is inflated,,,1
How much warning must be provided by the CO2 warning alarm before CO2 is discharged into a space?,Naval,B,5 seconds,10 seconds,15 seconds,20 seconds,,,4
CO2 extinguishes a fire by __________.,Naval,B,a blanket of bubbles formed on the surface of the fire,smothering,cooling,isolating the heat from the fuel,,,2
"First aid treatment for battery acid or alkali burns, especially in the eyes, includes __________.",Naval,B,flushing with large amounts of fresh water and seeking medical attention ashore or by radio,wiping the affected area with a clean dry cloth and resting quietly for several hours,drying the acid or alkali with a rag followed by applying a light cream,all of the above may be acceptable treatments depending on  the severity of the burn,,,1
Normal mouth temperature is __________.,Naval,B,96.4°F,97.5°F,98.6°F,99.7°F,,,3
Where would you look to find out what your duties are during a fire?,Naval,B,Coast Guard Regulations,Certificate of Inspection,Muster list,Ship's articles,,,3
An effective method for moving a patient with spinal injuries to a stretcher or spine board is known as the __________.,Naval,B,pack strap carry,two man extremities carry,fireman's drag,four man log roll,,,4
"The most effective method of extinguishing a class ""A"" fire is by __________.",Naval,B,quenching and cooling,using a sodium based dry chemical,blanketing and smothering,using nonconducting extinguishers,,,1
You can find the location of your abandon ship post by checking the __________.,Naval,B,vessel's logbook,vessel's documentation,muster list,Certificate of Inspection,,,3
The lights on the outside of the canopy of an inflatable liferaft operate __________.,Naval,B,by turning the globe clockwise,by a switch at each light,by a light sensor,automatically when the raft is inflated,,,4
Part 156 of the Pollution Prevention Regulations concerns __________.,Naval,B,oil and hazmat transfer operations,cargo vessel design,large oil transfer shoreside facilities,pumping equipment design,,,1
"When off loading garbage to another ship, your records must identify that ship by name and __________.",Naval,B,home port,operator's name of record,official number,master's name,,,3
"The best means of combating an oil fire on the surface of the water surrounding a vessel tied to the pier, is to use  __________.",Naval,B,water fog over the fire,solid water streams directly into the fire,dry chemical around the fire,foam directed against the vessel's side,,,4
Your assigned emergency stations aboard your vessel can be  found on the ship's __________.,Naval,B,muster list,certificate of inspection,clearance papers,permit to proceed,,,1
Fire and lifeboat stations are required to be listed on the __________.,Naval,B,ship's articles,muster list,bunk card,forecastle card,,,2
When administering first aid you should avoid __________.,Naval,B,any conversation with the patient,instructing bystanders,unnecessary haste and appearance of uncertainty,touching the patient,,,3
The best extinguishing agent for fighting a burning mattress fire is the use of __________.,Naval,B,carbon dioxide,water in a solid stream,foam,dry chemical,,,2
"In order to find out which lifeboat you are assigned, you should look at the __________.",Naval,B,fire control plan,certificate of inspection,muster list,ship's articles,,,3
"After launching, an inflatable raft should be kept dry inside by __________.",Naval,B,opening the automatic drain plugs,draining the water pockets,using the electric bilge pump,using the bailers and cellulose sponge,,,4
The authority to grant an alternate procedure for oil transfer operations rests with the __________.,Naval,B,Nearest Coast Guard office,"Officer-in-Charge, Marine Inspection",Area Commander,Captain of the Port,,,4
A vessel trimmed down by the bow has __________.,Naval,B,a greater draft forward than aft,zero trim,a low mean draft,a greater draft aft than forward,,,1
"According to Pollution Prevention Regulations (33 CFR), the maximum allowable working pressure (MAWP) for each hose assembly used for transferring oil must be __________.",Naval,B,at least 600 psi (4.14 MPa),more than the sum of the pressure of the relief valve setting,at least four times the sum for the pressure of the relief  valve setting,more than the maximum pump pressure when a relief valve is  not installed,,,2
When working around deck machinery it is a good safety practice to avoid standing in a 'bight' because __________.,Naval,B,it doesn't allow for proper faking of the line,the coil may become tangled and difficult to manage,a sudden yank on the line may trap your leg,a flemish may quickly knock you down,,,3
"Which of the following fire extinguishing agents is best suited for use on a large class ""B"" fire occurring on the open deck of a vessel?",Naval,B,CO2,Aqueous film forming foam,Dry chemical,Steam smothering system,,,2
What is the required gas supply capacity of an inert gas system?,Naval,B,125% of forced draft rate,125% of shore side loading rate,125% of cargo pump capacity,125% of fan capacity,,,3
"When making a permanent repair to an inflatable liferaft using a repair kit, how long after the repair is made should you hold off 'topping up' the lost air?",Naval,B,You do not have to hold off,12 hours,24 hours,2 hours,,,3
An application for an exemption of any requirements of the regulations for oil transfer operations must be submitted to the __________.,Naval,B,District Commander,Commandant,Captain of the Port,Nearest Coast Guard office,,,3
An inert gas system is designed to reduce the possibility of tank explosions by __________.,Naval,B,eliminating sparks and fire in the vicinity of cargo tanks,removing all hydrocarbon gases from the cargo tanks,blanketing cargo tanks with inert foam,reducing the oxygen concentration below levels necessary for combustion,,,4
"According to Pollution Prevention Regulations (33 CFR), the pump being used for cargo transfer has a relief valve setting of 65 psi and a static head of 10 feet.  The vessel's cargo hose used for the transfer must  have a maximum allowable working pressure of at least __________.",Naval,B,55 psi,65 psi,75 psi,98 psi,,,3
The amount of garbage disposed must be entered into the records maintained by each ship and stated in __________.,Naval,B,cubic meters,"barrels, measured in 55 gallon drums",weight in either kilogram or pounds,cubic yards convertible to long tons,,,1
Which unit will provide excellent mobilty to the wearer in an unsafe atmosphere and provide oxygen to sustain life?,Naval,B,A fresh air breathing apparatus,A self-contained breathing apparatus,An ammonia gas mask,All of the above,,,2
"According to Pollution Prevention Regulations (33 CFR), the pump being used for cargo transfer has a relief valve setting of 65 psi and a static head of 10 feet.  The vessel's cargo hose used for the transfer must  have a maximum allowable working pressure of at least __________.",Naval,B,55 psi,98 psi,at least four times the sum for the pressure of the relief valve setting plus static head pressure,at least more than the sum of the pressure of the relief valve setting plus the static head pressure,,,4
The sorting of accident victims according to the severity of their injuries is called __________.,Naval,B,evaluation,triage,surveying,prioritizing,,,2
"Which of the following statements is correct concerning fire hoses used within the machinery spaces of cargo vessels, on which the fire main installations were contracted for on, or after 26 May 1965?",Naval,B,The fire hoses must be in 75 foot lengths.,The fire hoses must be 1 1/2 inches in diameter or less.,The fire hoses must be of the lined type.,The fire hoses must all be fitted with approved 5/8 inch nozzles.,,,3
Which of the following statements is true concerning fire hose used in the engine room of a offshore supply vessel?,Naval,B,It must be marked with the name of the  vessel.,National Standard fire hose coupling threads shall be used  having 9 threads per inch for 2 1/2 inch hose and 7 1/2 threads per inch for 1 1/2 inch hose.,"In heavy weather, the hose may be removed temporarily from  the hydrant.",All of the above.,,,1
"In each inflatable raft, what piece of equipment is provided to make quick, emergency, temporary repairs to a cut, or rip in a raft?",Naval,B,There is no equipment provided,Glue and rubber patches,Several various-sized repair clamps,Self-adhesive rubberized canvas patches,,,3
An applications for a waiver of any requirements of the regulations for oil transfer operations must be submitted __________.,Naval,B,the day before the operations,5 days before the operations,10 days before the operations,30 days before the operations,,,4
Firehose can be used for purposes other than firefighting service when __________.,Naval,B,used for portable water service,used for drills and testing,determined by the Chief Engineer,approved by OCMI,,,2
The three positions of an all-purpose fire nozzle are __________.,Naval,B,"forward: off, center: fog, back: solid stream","forward: solid stream, center: fog, back: off","forward: fog, center: solid stream, back: off","forward: off, center: solid stream, back: fog",,,1
A tankship has 40 gallons of 6% foam concentrate aboard. Approximately how much foam solution can be produced from this supply?,Naval,B,200 gallons,420 gallons,667 gallons,986 gallons,,,3
Why should you wear a self-contained breathing apparatus before entering a closed compartment to fight a fire?,Naval,B,"The fire produces carbon monoxide which causes an oxygen deficiency in the brain and body, leading quickly to death.","The fire produces smoke, which contains toxic gases that cause breathing difficulties and irritation of the  respiratory tract.",The fire consumes oxygen which may lead to asphyxiation.,All of the above.,,,4
"The relief valve on a fire pump is set at 25 psi (1.75 kPA) above the pressure necessary to maintain the required fire  hose streams, or __________.",Naval,B,50 psi (345 kPa),75 psi (517 kPA),125 psi (862 kPa),150 psi (1034 kPa),,,3
No person may serve as the person-in-charge of oil transfer operations on more than one vessel at a time __________.,Naval,B,under any circumstances,unless authorized by the Captain of the Port,unless radio communication is set up between the vessels,unless the vessels are moored clear of all docks,,,2
A solid stream of water is produced by an all-purpose firefighting nozzle when the handle is __________.,Naval,B,pushed all the way forward,pushed forward one notch,pulled halfway back,pulled all the way back,,,4
The tendency of a ship to resist a change in trim is __________.,Naval,B,the righting arm couple,longitudinal stability,metacentric height,transverse inclination,,,2
"You are wearing a self-contained breathing apparatus while  fighting a fire in an enclosed space.  If sudden strong resistance to breathing is experienced, your first action should be to __________.",Naval,B,tug twice on your lifeline and slow your breathing until help arrives,retreat immediately to outside air,take a deep breath and remove your apparatus for adjustment,give two or three strong exhalations to increase the flow through the apparatus,,,2
A vessel sailing through the specific special areas may discharge or dispose of __________.,Naval,B,incinerated ash at anytime,"fairly dense material that will sink, i.e. metal cans or glass bottles at anytime",victual waste when at least 12 nautical miles from shore,absolutely no garbage at anytime,,,3
"Where there are multiple accident victims, which injuries should be the FIRST to receive emergency treatment?",Naval,B,Major multiple fractures,Eye injuries,Back injuries with spinal cord damage,Airway and breathing difficulties,,,4
"When launching an inflatable liferaft, you should make sure that the operating cord is __________.",Naval,B,fastened to some substantial part of the vessel,not fastened to anything,secured to the hydrostatic release,fastened to the raft container,,,1
No person may serve as the person-in-charge of both the vessel and the facility during oil transfer operation unless __________.,Naval,B,there is ready access between the two,the vessel and facility are immediately adjacent,the person in charge has a rapid means of transportation between the two,the Captain of the Port authorizes such procedure,,,4
How does an inert gas system on a tanker function to prevent explosions in cargo tanks?,Naval,B,"De-energizes the ""charged mist"" effect.",Maintains a positive pressure on the vent header to cool the flammable vapors.,Inert gas filters out the flammable vapors from the cargo tank spaces.,Inert gas dilutes the flammable vapor and air concentrations to keep them below the lower explosive limit.,,,4
The addition of weight at the longitudinal center of flotation will __________.,Naval,B,increase the forward draft and decrease the after draft,decrease the forward draft and increase the after draft,have no effect on the trim,have no effect on the stability,,,3
"When you are wearing a self-contained breathing apparatus, you should immediately return to fresh air if you feel __________.",Naval,B,heat in the canister or hose,excess air flow in the mask,two pulls on the safety line,"nauseous, dizziness or high breathing resistance",,,4
"Where there are multiple accident victims, which type of injury should be the first to receive emergency treatment?",Naval,B,Severe shock,Eye injuries,Burns,Major multiple fractures,,,1
"The purpose of the four water pockets, located on the underside at each corner of the raft, is to __________.",Naval,B,stow rainwater; these four spaces will not take up valuable space,act as stabilizers by filling with sea water as soon as raft is inflated and in an upright position,hold the freshwater required by regulation to be provided in the raft when packed,none of the above,,,2
The process that occurs when heat is generated by a chemical reaction within a substance and continues to a point of ignition is known as __________.,Naval,B,chemical ignition,spontaneous combustion,chemical combustion,radiation ignition,,,2
An inert gas system on a tanker should be used to __________.,Naval,B,prevent the generation of flammable or combustible gas in tanks,blow out cargo lines to prevent gas concentrations,dilute tank atmospheres to keep gas concentrations  below the lower explosive limit,prevent fires in the pumproom by continually displacing flammable vapors,,,3
"The low velocity fog applicator used in conjunction with the all-purpose firefighting nozzle, should always be __________.",Naval,B,stored in the rack when not in actual use,attached to the nozzle by the chain,coated with heavy grease to prevent corrosion,left in place in the all-purpose nozzle,,,1
What should you do when the alarm bell on a self-contained  breathing apparatus sounds?,Naval,B,Immediately evacuate the contaminated area.,Open the bypass valve on the regulator and immediately evacuate the contaminated area.,Move the reserve lever to the 'reserve' position on the regulator and reset the alarm so you can evacuate the area  when it sounds again.,Move the tank selector lever to the full tank position and  reset the alarm so you can evacuate the area when it sounds again.,,,1
"To serve as the person in charge of oil cargo transfer operations onboard a self-propelled tank vessel, an individual must __________.",Naval,B,be a certified tankerman (PIC),be licensed only,be 30 years old,have a letter from the company stating his qualification,,,1
"In managing a situation involving multiple injuries, the rescuer must be able to __________.",Naval,B,provide the necessary medication,rapidly evaluate the seriousness of obvious injuries,accurately diagnose the ailment or injury,prescribe treatment for the victim,,,2
"When an oil fire has been extinguished, the surface of the  oil should be kept covered with foam to prevent __________.",Naval,B,air from contacting the oil vapors permitting reignition,boiling of the heated oil,spontaneous combustion below the oil surface,toxic fumes from escaping to the surface,,,1
"For a fixed CO2 fire fighting system, if the maximum quantity of carbon dioxide required to be maintained aboard the  vessel is 2450 pounds,  the minimum nominal pipe size of the fixed system branch lines to the various spaces must be __________.",Naval,B,1.5 inches,2 inches,2.5 inches,3 inches,,,2
Water pockets on the under side of an inflatable liferaft are for __________.,Naval,B,catching rain water,stability,easy drainage,maneuverability,,,2
Through which of the listed processes is heat produced in spontaneous ignition?,Naval,B,Aeration,Anaeroboic decomposition,Putrefaction,Oxidation,,,4
Which of the following statements is correct regarding the  fog applicators used in conjunction with the combination nozzle?,Naval,B,All cargo and miscellaneous vessels must be equipped with high velocity fog applicators for use with the required combination nozzle at each station.,"In machinery spaces, the applicators should be 10 to 12 feet in length to insure all portions of the bilge can be effectively reached.","On container ships, an applicator termed a bayonet or piercing type utilizes a sharp tip for cutting and  penetrating the metal skin of a container.",All of the above.,,,3
"While wearing a self-contained breathing apparatus, the user must be aware of the bulkiness of the unit in order to avoid confined spaces.  Of what other limitations should the user be aware?",Naval,B,The weight of the unit changes the user's center of gravity.,The lens of the facepiece reduces the user's peripheral vision.,The attached lifeline limits the user's mobility.,All of the above.,,,4
"According to 33 CFR Part 156, each pressure gage used in an oil transfer operation must be accurate to within __________.",Naval,B,1 percent,3 percent,5 percent,10 percent,,,4
"After an injury, which of the following can be determined by examining the condition of a victim's pupils?",Naval,B,The degree of pain being suffered.,The degree of vision impairment.,Whether or not the brain is functioning properly.,Whether or not the victim's blood pressure is normal.,,,3
"When fighting an oil or gasoline fire, which of the listed  fire extinguishing agents should NEVER be sprayed directly  into the fire?",Naval,B,High velocity fog,Dry chemical,Low velocity fog,Steam smothering,,,2
"In the event of a fire, the doors to a stairtower must be closed to prevent the spread of fire by____________.",Naval,B,convection,conduction,radiation,ventilation,,,1
What is placed on the under side of an inflatable liferaft  to help prevent it from being skidded by the wind or overturned?,Naval,B,Ballast bags,A keel,Strikes,Sea anchor,,,1
Hazardous conditions exist which may result in spontaneous  combustion when __________.,Naval,B,oil soaked rags are stowed in the machine shop,powdered aluminum is stowed dry,dry metal turnings accumulate,all of the above,,,1
A person suffering from possible broken bones and internal injuries should __________.,Naval,B,be examined then walked to a bunk,be assisted in walking around,not be allowed to lie down where injured but moved to a chair or bunk,not be moved but made comfortable until medical assistance arrives,,,4
What is the primary purpose of a splint applied in first aid?,Naval,B,Reduce pain,Control bleeding,Immobilize a fracture,Reset the bone,,,3
Bleeding from a vein may be ordinarily controlled by __________.,Naval,B,pinching the wound closed,applying direct pressure to the wound,heavy application of a disinfectant,pouring ice water directly into the wound,,,2
"A wiper has a small, gaping laceration of the arm that is not bleeding excessively.  What can be done as an alternative to suturing to close the wound?",Naval,B,Apply a compression bandage.,Use temporary stitches of sail twin.,Wrap a tight bandage around the wound.,"Apply butterfly strips, then a sterile dressing.",,,4
"During oil transfer operations, who would be responsible to guarantee that the posted transfer procedures are being followed?",Naval,B,The designated person in charge,The tankerman,The senior able seaman,The oiler,,,1
