Question_Title,Subject_Name,Group_Name,Answer_1,Answer_2,Answer_3,Answer_4,Answer_5,Answer_6,Correct_Answer
"While providing assistant to a victim of an epileptic seizure, it is most important to __________.",Naval,B,give artificial respiration,prevent patient from hurting himself,keep the patient awake and make him/her walk if necessary to keep him/her awake,remove any soild clothing and put the patient in a clean bed,,,2
"A shipmate chokes suddenly, cannot speak, and starts to turn blue.  You should __________.",Naval,B,perform the Heimlich maneuver,make the victim lye down with the feet elevated to get blood to the brain,immediately administer CPR,do nothing until the victim becomes unconscious,,,1
A shipmate suffers a heart attack and stops breathing.  You must __________.,Naval,B,administer oxygen,immediately check his pulse and start CFR,make the victim comfotable in a bunk,"immediately give a stimulant, by force if necessary",,,2
A shipmate suffers a heart attack and stops breathing.  You must __________.,Naval,B,"immediately give a stimulant, by force if necessary",make the victim comfortable in a bunk,administer oxygen,immediatly start CPR,,,4
First aid means __________.,Naval,B,medical treatment of accident,setting of broken bones,emergency treatment at the scene of the injury,dosage of medications,,,3
To reduce mild fever the MOST useful drug is __________.,Naval,B,bicarbonate of soda,paregoric,asprin,aromatic spirts of ammonia,,,3
Treatment of sunstroke consists principally of __________.,Naval,B,"cooling, removing to shaded area, and lying down",bathing with rubbing alcohol,drinking ice water,All of the abovve,,,1
What are the symtoms of sunstroke?,Naval,B,"Temperature falls below normal, pulse is rapid and feeble, skin is cold and clammy.","Temperature is high, pulse is strong and rapid, skin is hot and dry.","Temperature is high, pulse is slow and feeble, skin is clammy.","Temperature falls below normal, pulse is rapid, skin is clammy.",,,2
"To extinguish an electrical fire, your FIRST action should  be to __________.",Naval,B,apply a low velocity fog,secure the power,Completely discharge a 15 pound (6.8 kg) CO2 extinguisher,apply mechanical or chemical foam,,,2
"To treat a person suffering from heat exhaustion, you should __________.",Naval,B,administer artificial respiration,put him in a tub of ice water,give him sips of cool water,cover him with a light cloth,,,3
Physical exertion on the part of a person who has fallen into cold water would __________.,Naval,B,be the best thing to try if there was no rescue in sight,increase survival time in the water,increase the rate of heat loss from the body,not affect the heat loss from the body,,,3
Seasickness is caused by rolling or rocking motions which affect fliuds in the __________.,Naval,B,stomach,lower intesines,inner ear,bladder,,,3
Symptoms of seasickness include __________.,Naval,B,fever and thirst,nausea and dizziness,stomach cramps and diarrhea,reddening of skin and hives,,,2
Symptoms of sugar diabetes include __________.,Naval,B,increased appetite and thirst,decreased appetite and thirst,gain in weight,elevated temperature,,,1
The symptons of a fractured back are __________.,Naval,B,leg cramps in the mucles in one or both legs,pain and uncontrolled jerking of the arms and legs,vomiting and involuntary urination or bowl movemnt,pain at the site of the fracture and possible numbness or paralysis below the injury,,,4
What is the procedure for checking for spinal cord damage in an unconscious patient?,Naval,B,"Beginning at the back of theneck, and proceeding to the buttocks, press the spine to find out where it hurts",Prick the skin of the hands and the soles of the feet with a sharp object to check for reaction,Selectively raise each arm and each leg and watch patient's face to see if he resisters pain,Roll patient onto his stomach and prick along the lengh of hos spine to check reaction,,,2
What are the symtom(s) of a ruptured appendix?,Naval,B,Dilated pupils and shallow breathing,Diarrhea and frequent urination,Muscle tenseness in almost the entire abdomen,Extream sweating and redding skin,,,3
Which proceedure should be followed when individuals are rescued in cold climates and suffer from hypothermia?,Naval,B,Give them brandy or other alcholic stimulation to promote a return to an acceptable body temperature.,Move them to a warm room to gradually raise their body temperature.,Keep them mvoing to stimulate ciculation to raise their body temperature.,Warm them under an electric blanket to rapidly regain normal body temperature.,,,2
"When fighting an electrical fire, you should first __________.",Naval,B,stop ventilation to the area,stop the vessel,secure electricity to the circuit,apply CO2 to the fire,,,3
The most effective treatment for warming a crew member suffering from hypothermia is __________.,Naval,B,running or jumping to increase circulation,raising body temperature rapidly by placing hands and feet in hot water,bundling the body in blankets to rewarm gardually,laying prone under heat lamps to rewarm rapidly,,,3
A crew member suffering from hypothermia should be given __________.,Naval,B,a small dose of alcohol,treatment for shock,a large meal,a brisk rub down,,,2
When administering first aid you should avoid __________.,Naval,B,any conversation with the patient,instructing bystanders,unnecessary haste and appearance of uncertainty,touching the patient before washing your hands,,,3
The primary concern in aiding a back injury patient is __________.,Naval,B,relieving the patient's pain by giving asprin or stronger medication,avoiding possible injury to the spinal cord by incorrect handling,preventing convulsions and muscle spasms caused by pain,providing enough fluids to prevent dehydration,,,2
"When personnel are lifted by a helicopter from an inflatable liferaft, the personnel on the raft should __________.",Naval,B,deflate the floor of the raft to reduce the danger of capsizing,inflate the floor of the raft to provide for additional stability,remove their lifejackets to prepare for the transfer,take in the sea anchor to prevent fouling of the rescue sling,,,1
"When a helicopter is lifting personnel from a rescue boat, the other individuals in the boat should  __________.",Naval,B,enter the water in case the person being lifted slips from  the sling,stand on the outside of the boat to assist the person being lifted,remove their lifejackets to prepare for their transfer to the helicopter,remain seated inside to provide body weight for stability,,,4
"""Category 1"" EPIRB's transmit on frequencies that are monitored by __________.",Naval,B,offshore supply vessels,commercial fishing vessels,orbiting satellites in space,naval warships,,,3
When should the emergency position-indicating radio beacon(EPIRB) be activated after abandoning an OSV?,Naval,B,Immediately,After one hour,Only when another vessel is in sight,Only after sunset,,,1
"After having activated the emergency position indicating radio beacon(EPRIB), you should __________.",Naval,B,turn it off for five minutes every half-hour,turn it off and on at five minute intervals,turn it off during daylight hours,leave it on continuously,,,4
Burning electrical insulation is best extinguished by __________.,Naval,B,soda acid,foam,water fog,carbon dioxide,,,4
"If you have to abandon ship, the EPIRB can be used to __________.",Naval,B,hold the lifeboat's head up into the seas,generate orange smoke,seal leaks in rubber rafts,send radio homing signals to searching aircraft,,,4
"When using a handheld smoke signal in a liferaft, you should __________.",Naval,B,activate the signal on the downwind side,activate the signal on the upwind side,activate the signal inside the boat,activate the signal at the stern,,,1
"When using a handheld smoke signal aboard a survival craft, you should activate the signal __________.",Naval,B,on the upwind side of the craft,inside the craft,at the stern of the craft,on the downwind side of the craft,,,4
Which of the following conditions represents the appropriate time for setting off distress flares and rockets?,Naval,B,Only when there is a chance of them being seen by rescue vessels.,At half-hour intervals.,At one hour intervals.,Immediately upon abandoning the vessel.,,,1
When should distress flares and rockets be used?,Naval,B,Only when there is a chance of them being seen by rescue vessels.,They should be set off at half-hour intervals.,They should be set off at one hour intervals.,Immediately upon abandoning the vessel.,,,1
Signaling devices required on inflatble liferafts include a(n) __________.,Naval,B,pistol,orange smoke signal,air horn,lantern,,,2
Signaling devices required on inflatble liferafts include __________.,Naval,B,a rocket shoulder rifle,an oil lantern,red flares,an air horn,,,3
"If a fire occurs in an electric cable, in which the inner layers of insulation, or the insulation covered by armor is burning, you should __________.",Naval,B,secure power to the cable,cut the cable with an insulated cable cutter,separate the two ends,all of the above,,,4
A distress signal __________.,Naval,B,consists of 5 or more short blasts of the fog signal apparatus,consists of the raising and lowering of a large white flag,may be used individually in conjuction with other distress signals,is used to indicate doubt about another vessel's intentions,,,3
All of the following are recognized distress signals under the Rules of the Road EXCEPT __________.,Naval,B,a green star signal,orange-colored smoke,red flares,the repeated raising and lowering of outstreched arms,,,1
"A man aboard a vessel, signaling by raising and lowering his outstretched arms to each side, is indicating __________.",Naval,B,"danger, stay away","all is clear, it is safe to pass","all is clear, it is safe to approach",a distress signal,,,4
Distress signals may be __________.,Naval,B,red flares,smoke signals,sound signals,All of the sbove,,,4
"When a vessel signals her distress by means of a gun or other explosive signal, the firing should be at intervals of aproximately __________.",Naval,B,1 minute,3 minute,10 minutes,1 hour,,,1
You can indicate that your vessel is in distress by __________.,Naval,B,displaying a large red flag,displaying three black balls in a vertical line,sounding four short blats and after two seconds sounding three more rapid blasts on the whistle,continously sounding the fog horn,,,4
Each personal flotation device light on an OSV that has a non-replaceable power source must be replaced __________.,Naval,B,every six months after initial installation,every 12 months after initial installation,every 24 months after initial installation,on or before the expiration date of the power source,,,4
Lifesaving equipment shall be stowed so that it will be  __________.,Naval,B,locked up,readily accessible for use,inaccessible to passengers,on the topmost deck of the vessel at all times,,,2
"When combating a class C fire, which of the following dangers may be present?",Naval,B,Flooding of the vessel,Increased surface area of the burning fluid,Water damage to machinery not involved in the fire,Toxic fumes from burning insulation,,,4
The light on a personal flotation device on a OSV  must be  replaced __________.,Naval,B,when the power source is replaced,each year after installation,every six months,as indicated by the expiration date,,,4
What is the minimum required number of ring life buoys on an OSV on ocean service ?,Naval,B,4,8,12,16,,,2
"Of the required ring life buoys for an OSV on ocean service, how many must be equipped with a waterlight?",Naval,B,1,2,4,8,,,3
"On a OSV, how many ring buoys are required to have a  buoyant line attached?",Naval,B,One ring life buoy,One ring life buoy on each side of the OSV,Three ring life buoys,Two ring life buoys on each side of the OSV,,,2
"Each distress signal and self-activated smoke signal must  be replaced not later than the marked date of expiration,  or from the date of manufacture, not later than __________.",Naval,B,12 months,24 months,36 months,42 months,,,2
"Each EPIRB required on a OSV, other than an EPIRB or SART in an inflatable liferaft, shall be tested using the integrated test circuit and output indicator every  __________.",Naval,B,week,two weeks,month,two months,,,3
"The person-in-charge shall insure that each rescue boat on a OSV is lowered to the water, launched, and operated at least once every __________.",Naval,B,month,two months,three months,six months,,,3
"For a OSV not on an international voyage, an approved substitute for an impulse projected rocket type line throwing appliance is a __________.",Naval,B,spring-loaded line thrower,hand thrown buoyant line,shoulder type throwing gun,heaving line,,,3
How often is the line throwing appliance required to be tested on an OSV ?,Naval,B,Once a month,Once a year,Once a week,Once every four months,,,1
"The most important property of any extinguishing agent used in fighting class ""C"" fires is the agent's __________.",Naval,B,cooling capacity,ability to suppress rekindling,nonconducting property,lack of fumes,,,3
The painter on a rigid liferaft must have a length sufficient to reach the highest waterline plus an additional __________.,Naval,B,5 meters (16 feet),10 meters (31 feet),15 meters (50 feet),20 meters (66 feet),,,4
The painter of an inflatable liferaft must have a minimum length of __________.,Naval,B,36 feet,50 feet,100 feet,300 feet,,,2
A life line must be connected to the liferaft __________.,Naval,B,at the bow,at the stern,in the middle,all around,,,4
"On vessels on an international voyage, each inflatable liferaft shall have a carrying capacity of not less than __________.",Naval,B,50 percent of all persons on board,75 percent of all persons on board,6 persons,10 persons,,,3
"If the buoyant force on a ship's hull is equal to or greater than the displacement tonnage, the ship will __________.",Naval,B,require ballast added to only the port side tanks,be down by the head,sink,float,,,4
A liferaft with a capacity of 8 people in ocean service is required by regulation to carry __________.,Naval,B,8 liters of fresh water,12 units of provisions,12 liters of fresh water,24 units of provisions,,,3
Who should inspect and test an inflatable liferaft?,Naval,B,The chief mate,An approved servicing facility,Shipyard personnel,A certified lifeboatman,,,2
Inflatable liferafts must be overhauled and inspected at a USCG approved servicing facility every __________.,Naval,B,six months,twelve months,eighteen months,twenty-four months,,,2
"Diesel fuel is relatively safe to handle due to its low volatility, but the fumes will self-ignite and continue to burn steadily if the fuel is heated to the __________.",Naval,B,flash point,autoignition point,volatility point,upper explosive limit,,,2
"""Portable"" tank cleaning machines are usually provided with a water supply from the __________.",Naval,B,inert gas scrubber,firemain,mucking supply system,pumproom sea chest,,,2
You must insure that lifesaving equipment is __________.,Naval,B,locked up,readily accessible for use,inaccessible to passengers,on the topmost deck of the vessel at all times,,,2
The capacity of any liferaft on board a vessel can be determined by __________.,Naval,B,examining the Certificate of Inspection,examining the plate on the outside of the container,"referring to the Muster List (""Station Bill"")",referring to the Shipping Articles,,,2
Information on the specification of a rescue boat can be found by __________.,Naval,B,examining the certificate of inspection,examining the nameplate on the transom,"referring to the Muster List (""Station Bill"")",referring to the shipping articles,,,2
"When a vessel is inclined, the tendency for it to return to its original position is caused by the __________.",Naval,B,movement of the center of gravity,movement of the center of buoyancy toward the low side of the vessel,upward movement of the center of flotation,increased free surface in the buoyant wedge,,,2
"When using the rainwater collection tubes on a liferaft, the FIRST collection should be __________.",Naval,B,passed around so all can drink,poured overboard because of salt washed off the canopy,saved to be used at a later time,used to boil food,,,2
"While adrift in an inflatable liferaft in hot, tropical  weather __________.",Naval,B,the canopy should be deflated so that it will not block cooling breezes,the pressure valve may be periodically opened to prevent excessive air pressure,deflating the floor panels may help to cool personnel,the entrance curtains should never be opened,,,3
You have abandoned ship in tropical waters. Which of the following procedeures should be used during a prolonged period in a liferaft ?,Naval,B,Wet clothes during the day to decrease perspiration.,Get plenty of rest.,Keep the entrance curtains opened.,All of the above.,,,4
You have abandoned ship and are in charge of a liferaft or  lifeboat.  How much water per day should you permit each  person after the first 24 hours?,Naval,B,1 can,1 pint,1 quart,1 gallon,,,2
When should food and water be provided to survivors after boarding a lifeboat or liferaft?,Naval,B,After 12 hours,After 24 hours,After 48 hours,Some food and water immediately and then not until 48 hours later,,,2
"After abandoning a vessel, water consumed within the first  24 hours __________.",Naval,B,will pass through the body with very little being absorbed  by the system,will help to prevent fatigue,will quench thirst for only two hours,helps to prevent seasickness,,,1
"In the first 24 hours after abandoning a vessel, water should be given only to personnel who are __________.",Naval,B,thirsty,sick or injured,wet,awake,,,2
The center of volume of the immersed portion of the vessel  is the __________.,Naval,B,center of flotation,metacentric height,center of buoyancy,center of gravity,,,3
"If there are a number of survivors in the water after  abandoning an OSV and no rescue craft or liferaft are in sight, they should __________.",Naval,B,tie themselves to the unit to avoid drifting with the current,group to form a small circle of survivors to create a warmer pocket of water in the center of the circle,send the strongest swimmer to shore for assistance,form a raft by lashing their lifejackets together,,,2
"To keep injured survivors warm in the water after abandoning an OSV, they should __________.",Naval,B,be placed in the middle of a small circle formed by the other survivors in the water,float on their backs with their arms extended for maximum exposure to the air,remove their lifejackets and hold on to the uninjured survivors,sip seawater at intervals of fifteen minutes,,,1
"If you continue to wear extra clothing when entering the water after abandoning your vessel, it will __________.",Naval,B,weigh you down,preserve body heat,reduce body heat,make it more difficult to breathe,,,2
The most important characteristic of a fire extinguishing agent to be used on electrical fires is for the agent to be __________.,Naval,B,nonconducting,flame resistant,easily removable,wet,,,1
"If help has not arrived in 10-12 hours after having abandoned an OSV in a survival craft, you should __________.",Naval,B,go in one direction until the fuel runs out,plot course for the nearest land,take a vote on which direction you should go,shutdown the engines and set the sea anchor,,,4
"Provided every effort is used to produce, as well as preserve body moisture content by avoiding perspiration, how long is it normally possible to survive without stored quantities of water?",Naval,B,Up to 3 days,8 to 14 days,15 to 20 days,25 to 30 days,,,2
All OSV personnel should be familiar with the survival craft __________.,Naval,B,boarding and operating procedures,maintenance schedule,navigational systems,fuel consumption rates,,,1
A liferaft which has inflated bottom-up on the water  __________.,Naval,B,"should be righted by standing on the carbon dioxide cylinder, holding the righting straps and leaning backwards","should be righted by standing on the lifeline, holding the  righting straps and leaning backwards",will right itself when the canopy tube inflate,must be cleared of the buoyant equipment before it will right itself,,,1
"If an inflatable liferaft is overturned, it may be righted  by __________.",Naval,B,filling the stabilizers on one side with water,releasing the CO2 cylinder,pushing up from under one end,standing on the inflating cylinder and pulling on the straps on the underside of the raft,,,4
"When a vessel is inclined due to an external force, such as the action of seas in which no cargo shifts, the tendency of the vessel to return to its original position is caused by  the shift in __________.",Naval,B,center of buoyancy,center of gravity,center of flotation,metacentric radius,,,1
"During an abandonment or drill, the first person to arrive at the survival craft should __________.",Naval,B,pass out food and water to personnel,open the doors and start the sprinkler system,activate the emergency release handle,open the doors and prepare the craft for boarding,,,4
"Immediately after abandoning a vessel, lookouts should be posted aboard liferafts to look for __________.",Naval,B,survivors in the water,food and water,land,bad weather,,,1
One of the first actions to be taken by survivors when they have boarded an inflatable liferaft is to __________.,Naval,B,break out food rations,read the instruction card,open the pressure relief valve,drink at least one can of water,,,2
One of the first actions to be taken by survivors when they have boarded an inflatable liferaft is to __________.,Naval,B,break out food rations,prepare to cut the sea painter,open the pressure relief valve,drink at least one can of water,,,2
"If you reach shore in a liferaft, the first thing to do is __________.",Naval,B,drag the raft ashore and lash it down for shelter,find some wood for a fire,get the provisions out of the raft,set the raft back out to sea so someone may spot it,,,1
"When a ship is abandoned and there are several liferafts in the water, one of the FIRST things to be done is __________.",Naval,B,separate the rafts as much as possible to increase chances  of detection,transfer all supplies to one raft,transfer all the injured to one raft,secure the rafts together to keep them from drifting apart,,,4
"If more than one liferaft is manned after the vessel has sunk, __________.",Naval,B,each raft should go in a different direction in search of land,the possibility of a search aircraft finding you is increased by spreading out,reduce the number of rafts by getting as many people as possible into as few rafts as possible,tie each of the rafts together and try to stay in a single  group,,,4
"If you have to abandon ship and enter a liferaft, your main course of action should be __________.",Naval,B,remain in the vicinity of the vessel,head for the closest land,head for the closest sea-lanes,get a majority opinion,,,1
Class C fires may be combatted using a __________.,Naval,B,dry chemical extinguisher,carbon dioxide extinguisher,halon extinguisher,all of the above,,,4
"If you are forced to abandon ship in a rescue boat, you should __________.",Naval,B,remain in the vicinity of the vessel,head for the nearest land,head for the closest sea-lanes,have an all hands vote on what to do,,,1
"If you are forced to abandon an OSV, following the launching of the survival craft you should __________.",Naval,B,plot a course to the nearest land,take a vote on which direction to go,stay in the immediate area,go in one direction until the fuel runs out,,,3
Which statement is TRUE concerning an inflatable liferaft?,Naval,B,The floor may be inflated for insulation from cold water.,Crew members can jump into the raft without damaging it.,The raft may be boarded before it is fully inflated.,All of the above.,,,4
Which of the following emergency signals are used to report for boat stations or boat drills?,Naval,B,Three short blasts of the whistle along with the same signal on the general alarm bells.,"More than six short blasts and one long blast of the whistle, along with the same signal on the general alarm bells.","Steady rapid ringing of the ship's bell for at least 10 seconds, along with the same signal on the general alarm bells.","Less than five short blasts and one long blast of the whistle, along with the same signal on the general alarm bells.",,,2
"When more than six short blasts and one long blast of the ship's whistle, accompanied by the same signal on the general alarm bell is sounded, the signal is for __________.",Naval,B,fire and emergency,boat recall,man overboard,boat stations (abandon ship),,,4
"While at your lifeboat station, you hear a signal consisting of one short blast of the whistle.  This indicates __________.",Naval,B,abandon ship,commence lowering boats,stop lowering boats,secure from boat stations,,,2
"Traditionally, the signal for fire aboard a vessel is __________.",Naval,B,More than six short blasts and one long blast on the whistle.,Continuous blast of the ship's whistle for a period of not  less than 10 seconds supplemented by the same signal on the general alarm.,Three short blasts of the whistle supplemented by the same  signal on the general alarm.,More than six short blasts and one long blast on the whistle supplemented by the same signal on the general alarm.,,,2
"To fight a class ""C"" fire, you should use carbon dioxide or __________.",Naval,B,mechanical foam,dry chemical,chemical foam,chemically teated saw dust,,,2
"The fire alarm signal onboard United States flag merchant vessels is a continuous blast of the whistle for a period of not less than 10 seconds, supplemented by the continuous ringing of the general alarm bells for not less than 10 seconds.  Where can this information be readily found aboard ship?",Naval,B,Certificate of Inspection,"Muster List (""Station Bill"")",SOLAS Safety Construction Certificate,Fire Alarm Zone Chart,,,2
